test/.cache/tunecache_error.tsv
tunecache	1.1.0	1.1.0-b58f1ecb5-sm_80	cpu_arch=x86_64,gpu_arch=sm_80,cuda_version=12.4.131	# Last updated Fri May  2 13:39:14 2025

          volume	name	aux	block.x	block.y	block.z	grid.x	grid.y	grid.z	shared_bytes	aux.x	aux.y	aux.z	aux.w	time	comment
