test/.cache/tunecache_error.tsv
tunecache	1.1.0	1.1.0-b58f1ecb5-sm_80	cpu_arch=x86_64,gpu_arch=sm_80,cuda_version=12.4.131	# Last updated Sat May 10 01:38:21 2025

          volume	name	aux	block.x	block.y	block.z	grid.x	grid.y	grid.z	shared_bytes	aux.x	aux.y	aux.z	aux.w	time	comment
     32x16x32x32	N4quda12ExtractGhostIdLi3ENS_5gauge11FloatNOrderIdLi18ELi2ELi12EL20QudaStaggeredPhase_s0ELb1EL19QudaGhostExchange_sn2147483648ELb0EEEEE	GPU-offline,vol=524288,stride=278528,precision=8,geometry=4,Nc=3,extract	32	1	5	1024	1	2	0	-1	-1	-1	-1	1.49358e-05	# 0.00 Gflop/s, 1053.09 GB/s, tuning took 0.078381 seconds at Sat May 10 01:10:37 2025
     32x16x32x32	N4quda9CopyGaugeINS_12CopyGaugeArgIddLi18ELb0ENS_5gauge11FloatNOrderIdLi18ELi2ELi12EL20QudaStaggeredPhase_s0ELb1EL19QudaGhostExchange_sn2147483648ELb0EEENS2_8QDPOrderIdLi18EEEEEEE	GPU-offline,vol=524288,stride=262144,precision=8,geometry=4,Nc=3,vol=524288,stride=278528,precision=8,geometry=4,Nc=3	928	1	1	283	1	8	0	-1	-1	-1	-1	0.00226611	# 0.00 Gflop/s, 227.66 GB/s, tuning took 0.714255 seconds at Sat May 10 01:10:37 2025
     32x16x32x32	N4quda9CopyGaugeINS_12CopyGaugeArgIddLi18ELb0ENS_5gauge11FloatNOrderIdLi18ELi2ELi12EL20QudaStaggeredPhase_s0ELb1EL19QudaGhostExchange_sn2147483648ELb0EEES6_EEEE	GPU-offline,vol=524288,stride=278528,precision=8,geometry=4,Nc=3,vol=524288,stride=278528,precision=8,geometry=4,Nc=3,ghost	32	1	3	512	1	3	0	-1	-1	-1	-1	1.31646e-05	# 0.00 Gflop/s, 1269.44 GB/s, tuning took 0.021621 seconds at Sat May 10 01:10:37 2025
     32x16x32x32	N4quda9CopyGaugeINS_12CopyGaugeArgIfdLi18ELb0ENS_5gauge11FloatNOrderIfLi18ELi4ELi12EL20QudaStaggeredPhase_s0ELb1EL19QudaGhostExchange_sn2147483648ELb0EEENS3_IdLi18ELi2ELi12ELS4_0ELb1ELS5_n2147483648ELb0EEEEEEE	GPU-offline,vol=524288,stride=278528,precision=8,geometry=4,Nc=3,vol=524288,stride=278528,precision=4,geometry=4,Nc=3	352	1	2	745	1	4	0	-1	-1	-1	-1	0.00135339	# 0.00 Gflop/s, 237.08 GB/s, tuning took 0.417584 seconds at Sat May 10 01:10:38 2025
     32x16x32x32	N4quda9CopyGaugeINS_12CopyGaugeArgIfdLi18ELb0ENS_5gauge11FloatNOrderIfLi18ELi4ELi12EL20QudaStaggeredPhase_s0ELb1EL19QudaGhostExchange_sn2147483648ELb0EEENS3_IdLi18ELi2ELi12ELS4_0ELb1ELS5_n2147483648ELb0EEEEEEE	GPU-offline,vol=524288,stride=278528,precision=8,geometry=4,Nc=3,vol=524288,stride=278528,precision=4,geometry=4,Nc=3,ghost	128	1	1	128	1	8	0	-1	-1	-1	-1	2.048e-05	# 0.00 Gflop/s, 612.00 GB/s, tuning took 0.020278 seconds at Sat May 10 01:10:38 2025
     32x16x32x32	N4quda9CopyGaugeINS_12CopyGaugeArgIsdLi18ELb0ENS_5gauge11FloatNOrderIsLi18ELi4ELi12EL20QudaStaggeredPhase_s0ELb1EL19QudaGhostExchange_sn2147483648ELb0EEENS3_IdLi18ELi2ELi12ELS4_0ELb1ELS5_n2147483648ELb0EEEEEEE	GPU-offline,vol=524288,stride=278528,precision=8,geometry=4,Nc=3,vol=524288,stride=278528,precision=2,geometry=4,Nc=3	352	1	1	745	1	8	0	-1	-1	-1	-1	0.00107827	# 0.00 Gflop/s, 247.98 GB/s, tuning took 0.335224 seconds at Sat May 10 01:10:37 2025
     32x16x32x32	N4quda9CopyGaugeINS_12CopyGaugeArgIsdLi18ELb0ENS_5gauge11FloatNOrderIsLi18ELi4ELi12EL20QudaStaggeredPhase_s0ELb1EL19QudaGhostExchange_sn2147483648ELb0EEENS3_IdLi18ELi2ELi12ELS4_0ELb1ELS5_n2147483648ELb0EEEEEEE	GPU-offline,vol=524288,stride=278528,precision=8,geometry=4,Nc=3,vol=524288,stride=278528,precision=2,geometry=4,Nc=3,ghost	64	1	1	256	1	8	0	-1	-1	-1	-1	2.05013e-05	# 0.00 Gflop/s, 509.47 GB/s, tuning took 0.020549 seconds at Sat May 10 01:10:37 2025
         8x8x8x8	N4quda11CopyGaugeExIddLi18ENS_5gauge11FloatNOrderIdLi18ELi2ELi12EL20QudaStaggeredPhase_s0ELb1EL19QudaGhostExchange_sn2147483648ELb0EEES5_EE	GPU-offline,vol=4096,stride=2304,precision=8,geometry=4,Nc=3vol=4096,stride=2048,precision=8,geometry=4,Nc=3,r=0000	256	1	1	8	2	1	0	-1	-1	-1	-1	1.02972e-05	# 0.00 Gflop/s, 324.59 GB/s, tuning took 0.049410 seconds at Sat May 10 01:38:18 2025
         8x8x8x8	N4quda12CloverInvertIdEE	GPU-offline,vol=4096precision=8Nc=3,twist=false	96	2	1	37	1	1	12289	-1	-1	-1	-1	0.000108544	# 0.00 Gflop/s, 43.47 GB/s, tuning took 2.465494 seconds at Sat May 10 01:38:21 2025
         8x8x8x8	N4quda12ExtractGhostIdLi3ENS_5gauge11FloatNOrderIdLi18ELi2ELi12EL20QudaStaggeredPhase_s0ELb1EL19QudaGhostExchange_sn2147483648ELb0EEEEE	GPU-offline,vol=4096,stride=2304,precision=8,geometry=4,Nc=3,extract	64	1	1	8	1	8	2138	-1	-1	-1	-1	5.75948e-06	# 0.00 Gflop/s, 68.27 GB/s, tuning took 0.042970 seconds at Sat May 10 01:32:25 2025
         8x8x8x8	N4quda13ComputeCloverIdEE	GPU-offline,vol=4096precision=8Nc=3	224	1	1	10	2	1	0	-1	-1	-1	-1	2.31656e-05	# 84.87 Gflop/s, 254.61 GB/s, tuning took 0.027424 seconds at Sat May 10 01:38:19 2025
         8x8x8x8	N4quda5FmunuIdLi3EL21QudaReconstructType_s12EEE	GPU-offline,vol=4096,stride=2048,precision=8,geometry=4,Nc=3,r=0000,comm=0000	32	2	1	64	1	6	3073	-1	-1	-1	-1	0.000402773	# 150.47 Gflop/s, 102.51 GB/s, tuning took 0.488699 seconds at Sat May 10 01:38:19 2025
         8x8x8x8	N4quda9CopyGaugeINS_12CopyGaugeArgIddLi18ELb0ENS_5gauge11FloatNOrderIdLi18ELi2ELi12EL20QudaStaggeredPhase_s0ELb1EL19QudaGhostExchange_sn2147483648ELb0EEENS2_8QDPOrderIdLi18EEEEEEE	GPU-offline,vol=4096,stride=2048,precision=8,geometry=4,Nc=3,vol=4096,stride=2304,precision=8,geometry=4,Nc=3	32	1	4	64	1	2	0	-1	-1	-1	-1	8.96731e-06	# 0.00 Gflop/s, 460.42 GB/s, tuning took 0.048294 seconds at Sat May 10 01:32:25 2025
         8x8x8x8	N4quda9CopyGaugeINS_12CopyGaugeArgIddLi18ELb0ENS_5gauge11FloatNOrderIdLi18ELi2ELi12EL20QudaStaggeredPhase_s0ELb1EL19QudaGhostExchange_sn2147483648ELb0EEES6_EEEE	GPU-offline,vol=4096,stride=2304,precision=8,geometry=4,Nc=3,vol=4096,stride=2304,precision=8,geometry=4,Nc=3,ghost	32	1	2	8	1	4	0	-1	-1	-1	-1	5.9392e-06	# 0.00 Gflop/s, 74.48 GB/s, tuning took 0.023521 seconds at Sat May 10 01:32:25 2025
         8x8x8x8	N4quda9CopyGaugeINS_12CopyGaugeArgIfdLi18ELb0ENS_5gauge11FloatNOrderIfLi18ELi4ELi12EL20QudaStaggeredPhase_s0ELb1EL19QudaGhostExchange_sn2147483648ELb0EEENS3_IdLi18ELi2ELi12ELS4_0ELb1ELS5_n2147483648ELb0EEEEEEE	GPU-offline,vol=4096,stride=2304,precision=8,geometry=4,Nc=3,vol=4096,stride=2304,precision=4,geometry=4,Nc=3	352	1	1	6	1	8	0	-1	-1	-1	-1	8.75481e-06	# 0.00 Gflop/s, 303.17 GB/s, tuning took 0.018248 seconds at Sat May 10 01:32:26 2025
         8x8x8x8	N4quda9CopyGaugeINS_12CopyGaugeArgIfdLi18ELb0ENS_5gauge11FloatNOrderIfLi18ELi4ELi12EL20QudaStaggeredPhase_s0ELb1EL19QudaGhostExchange_sn2147483648ELb0EEENS3_IdLi18ELi2ELi12ELS4_0ELb1ELS5_n2147483648ELb0EEEEEEE	GPU-offline,vol=4096,stride=2304,precision=8,geometry=4,Nc=3,vol=4096,stride=2304,precision=4,geometry=4,Nc=3,ghost	32	1	4	8	1	2	0	-1	-1	-1	-1	6.75004e-06	# 0.00 Gflop/s, 49.15 GB/s, tuning took 0.030996 seconds at Sat May 10 01:32:26 2025
         8x8x8x8	N4quda9CopyGaugeINS_12CopyGaugeArgIsdLi18ELb0ENS_5gauge11FloatNOrderIsLi18ELi4ELi12EL20QudaStaggeredPhase_s0ELb1EL19QudaGhostExchange_sn2147483648ELb0EEENS3_IdLi18ELi2ELi12ELS4_0ELb1ELS5_n2147483648ELb0EEEEEEE	GPU-offline,vol=4096,stride=2304,precision=8,geometry=4,Nc=3,vol=4096,stride=2304,precision=2,geometry=4,Nc=3	64	1	3	32	1	3	0	-1	-1	-1	-1	8.84128e-06	# 0.00 Gflop/s, 250.17 GB/s, tuning took 0.017702 seconds at Sat May 10 01:32:25 2025
         8x8x8x8	N4quda9CopyGaugeINS_12CopyGaugeArgIsdLi18ELb0ENS_5gauge11FloatNOrderIsLi18ELi4ELi12EL20QudaStaggeredPhase_s0ELb1EL19QudaGhostExchange_sn2147483648ELb0EEENS3_IdLi18ELi2ELi12ELS4_0ELb1ELS5_n2147483648ELb0EEEEEEE	GPU-offline,vol=4096,stride=2304,precision=8,geometry=4,Nc=3,vol=4096,stride=2304,precision=2,geometry=4,Nc=3,ghost	96	1	1	3	1	8	0	-1	-1	-1	-1	6.67949e-06	# 0.00 Gflop/s, 41.39 GB/s, tuning took 0.022402 seconds at Sat May 10 01:32:25 2025
   bytes=1572864	cudaMemcpyDeviceToDevice	exchangeGhost,gauge_field.cpp,527	32	1	1	1	1	1	0	-1	-1	-1	-1	8.91314e-06	# 0.00 Gflop/s, 352.93 GB/s, tuning took 0.000472 seconds at Sat May 10 01:10:37 2025
    bytes=196608	cudaMemset	allocateGhostBuffer,lattice_field.cpp,278	32	1	1	1	1	1	0	-1	-1	-1	-1	1.18204e-05	# 0.00 Gflop/s, 16.63 GB/s, tuning took 0.000513 seconds at Sat May 10 01:32:25 2025
    bytes=196608	cudaMemset	allocateGhostBuffer,lattice_field.cpp,283	32	1	1	1	1	1	0	-1	-1	-1	-1	1.64383e-05	# 0.00 Gflop/s, 11.96 GB/s, tuning took 0.001762 seconds at Sat May 10 01:32:25 2025
   bytes=3145728	cudaMemcpyDeviceToDevice	exchangeGhost,gauge_field.cpp,527	32	1	1	1	1	1	0	-1	-1	-1	-1	4.59594e-05	# 0.00 Gflop/s, 136.89 GB/s, tuning took 0.001502 seconds at Sat May 10 01:10:37 2025
     bytes=49152	cudaMemcpyDeviceToDevice	exchangeGhost,gauge_field.cpp,527	32	1	1	1	1	1	0	-1	-1	-1	-1	1.00571e-05	# 0.00 Gflop/s, 9.77 GB/s, tuning took 0.000589 seconds at Sat May 10 01:32:25 2025
    bytes=589824	cudaMemcpyDefault	copy,gauge_field.cpp,1085	32	1	1	1	1	1	0	-1	-1	-1	-1	1.28301e-05	# 0.00 Gflop/s, 45.97 GB/s, tuning took 0.001372 seconds at Sat May 10 01:32:25 2025
  bytes=75497472	cudaMemcpyDefault	copy,gauge_field.cpp,1085	32	1	1	1	1	1	0	-1	-1	-1	-1	0.000744192	# 0.00 Gflop/s, 101.45 GB/s, tuning took 0.010785 seconds at Sat May 10 01:10:36 2025
   bytes=7864320	cudaMemset	allocateGhostBuffer,lattice_field.cpp,278	32	1	1	1	1	1	0	-1	-1	-1	-1	1.21468e-05	# 0.00 Gflop/s, 647.44 GB/s, tuning took 0.002648 seconds at Sat May 10 01:10:37 2025
   bytes=7864320	cudaMemset	allocateGhostBuffer,lattice_field.cpp,283	32	1	1	1	1	1	0	-1	-1	-1	-1	1.24928e-05	# 0.00 Gflop/s, 629.51 GB/s, tuning took 0.000845 seconds at Sat May 10 01:10:37 2025
